{
  "plan_schema": "autopw.test-plan/1.0",
  "plan_id": "legacy-todo-12",
  "generated_at": "2026-08-07T00:00:00.000Z",
  "origin": { "type": "migrated", "source_ref": "fixtures/legacy-todo" },
  "coverage_eligible": true,
  "cases": [
    { "case_id": "legacy_A_not_found", "title": "A task not found", "feature_id": "todo.not_found", "requirement_refs": ["req_task_not_found"], "scenario": "not_found", "priority": "P0", "effective_tier": "fast", "kind": "api", "risk": "read_only", "confidence": 1, "execution_policy": { "production_allowed": false, "retries": 0 }, "steps": [{ "action": "api_request", "method": "GET", "path": "/api/tasks/task_missing", "save_as": "missing" }, { "action": "expect_status", "source": "$missing", "equals": 404 }] },
    { "case_id": "legacy_B_title_validation", "title": "B title validation", "feature_id": "todo.title_validation", "requirement_refs": ["req_task_title_validation"], "scenario": "invalid_input", "priority": "P0", "effective_tier": "fast", "kind": "api", "risk": "read_only", "confidence": 1, "execution_policy": { "production_allowed": false, "retries": 0 }, "steps": [{ "action": "api_request", "method": "POST", "path": "/api/tasks", "body": { "title": "", "priority": "normal" }, "save_as": "empty_title" }, { "action": "expect_status", "source": "$empty_title", "equals": 400 }, { "action": "api_request", "method": "POST", "path": "/api/tasks", "body": { "title": "123456789012345678901234567890123456789012345678901234567890123456789012345678901", "priority": "normal" }, "save_as": "long_title" }, { "action": "expect_status", "source": "$long_title", "equals": 400 }] },
    { "case_id": "legacy_C_summary", "title": "C summary", "feature_id": "todo.summary", "requirement_refs": ["req_task_summary"], "scenario": "normal", "priority": "P0", "effective_tier": "fast", "kind": "api", "risk": "mutating", "confidence": 1, "execution_policy": { "production_allowed": false, "retries": 0 }, "setup": [{ "action": "api_request", "method": "POST", "path": "/api/tasks", "body": { "title": "summary item", "priority": "normal" }, "save_as": "created" }], "steps": [{ "action": "api_request", "method": "GET", "path": "/api/summary", "save_as": "summary" }, { "action": "expect_json", "source": "$summary", "path": "total", "equals": 1 }, { "action": "expect_json", "source": "$summary", "path": "open", "equals": 1 }], "cleanup": [{ "action": "api_request", "method": "DELETE", "path": "/api/tasks/${responses.created.body.id}", "save_as": "deleted" }, { "action": "expect_status", "source": "$deleted", "equals": 204 }] },
    { "case_id": "legacy_D_create_refresh", "title": "D create and refresh", "feature_id": "todo.create_refresh", "requirement_refs": ["req_task_create_refresh"], "scenario": "normal", "priority": "P0", "effective_tier": "fast", "kind": "hybrid", "risk": "mutating", "confidence": 1, "execution_policy": { "production_allowed": false, "retries": 0 }, "steps": [{ "action": "goto", "path": "/" }, { "action": "fill", "locator": { "by": "id", "value": "title" }, "value": "refresh item" }, { "action": "click", "locator": { "by": "role", "role": "button", "name": "Create task" } }, { "action": "expect_text", "locator": { "by": "text", "text": "refresh item" }, "contains": "refresh item" }, { "action": "api_request", "method": "GET", "path": "/api/tasks?q=refresh%20item", "save_as": "listed" }, { "action": "capture_json", "source": "$listed", "path": "0.id", "save_as": "created_id" }], "cleanup": [{ "action": "api_request", "method": "DELETE", "path": "/api/tasks/${variables.created_id}", "save_as": "deleted" }, { "action": "expect_status", "source": "$deleted", "equals": 204 }] },
    { "case_id": "legacy_E_completed", "title": "E completed display", "feature_id": "todo.completed", "requirement_refs": ["req_task_completed"], "scenario": "persistence", "priority": "P0", "effective_tier": "fast", "kind": "api", "risk": "mutating", "confidence": 1, "execution_policy": { "production_allowed": false, "retries": 0 }, "setup": [{ "action": "api_request", "method": "POST", "path": "/api/tasks", "body": { "title": "completed item", "priority": "high" }, "save_as": "created" }], "steps": [{ "action": "api_request", "method": "PATCH", "path": "/api/tasks/${responses.created.body.id}", "body": { "completed": true }, "save_as": "updated" }, { "action": "expect_status", "source": "$updated", "equals": 200 }, { "action": "expect_json", "source": "$updated", "path": "completed", "equals": true }], "cleanup": [{ "action": "api_request", "method": "DELETE", "path": "/api/tasks/${responses.created.body.id}", "save_as": "deleted" }, { "action": "expect_status", "source": "$deleted", "equals": 204 }] },
    { "case_id": "legacy_F_delete", "title": "F delete task", "feature_id": "todo.delete", "requirement_refs": ["req_task_delete"], "scenario": "normal", "priority": "P0", "effective_tier": "fast", "kind": "api", "risk": "mutating", "confidence": 1, "execution_policy": { "production_allowed": false, "retries": 0 }, "setup": [{ "action": "api_request", "method": "POST", "path": "/api/tasks", "body": { "title": "delete item", "priority": "low" }, "save_as": "created" }], "steps": [{ "action": "api_request", "method": "DELETE", "path": "/api/tasks/${responses.created.body.id}", "save_as": "deleted" }, { "action": "expect_status", "source": "$deleted", "equals": 204 }, { "action": "api_request", "method": "GET", "path": "/api/tasks/${responses.created.body.id}", "save_as": "missing" }, { "action": "expect_status", "source": "$missing", "equals": 404 }] },
    { "case_id": "legacy_G_priority", "title": "G invalid priority", "feature_id": "todo.priority", "requirement_refs": ["req_task_priority_enum"], "scenario": "invalid_input", "priority": "P1", "effective_tier": "fast", "kind": "api", "risk": "read_only", "confidence": 1, "execution_policy": { "production_allowed": false, "retries": 0 }, "steps": [{ "action": "api_request", "method": "POST", "path": "/api/tasks", "body": { "title": "priority item", "priority": "urgent" }, "save_as": "invalid" }, { "action": "expect_status", "source": "$invalid", "equals": 400 }] },
    { "case_id": "legacy_H_detail", "title": "H detail content", "feature_id": "todo.detail", "requirement_refs": ["req_task_detail"], "scenario": "normal", "priority": "P1", "effective_tier": "fast", "kind": "api", "risk": "mutating", "confidence": 1, "execution_policy": { "production_allowed": false, "retries": 0 }, "setup": [{ "action": "api_request", "method": "POST", "path": "/api/tasks", "body": { "title": "detail item", "priority": "normal" }, "save_as": "created" }], "steps": [{ "action": "api_request", "method": "GET", "path": "/api/tasks/${responses.created.body.id}", "save_as": "detail" }, { "action": "expect_json", "source": "$detail", "path": "title", "equals": "detail item" }], "cleanup": [{ "action": "api_request", "method": "DELETE", "path": "/api/tasks/${responses.created.body.id}", "save_as": "deleted" }, { "action": "expect_status", "source": "$deleted", "equals": 204 }] },
    { "case_id": "legacy_I_frontend_cors", "title": "I frontend PATCH CORS", "feature_id": "todo.cors", "requirement_refs": ["req_task_patch_cors"], "scenario": "cors", "priority": "P1", "effective_tier": "fast", "kind": "api", "risk": "read_only", "confidence": 1, "execution_policy": { "production_allowed": false, "retries": 0 }, "steps": [{ "action": "api_request", "method": "OPTIONS", "path": "/api/tasks/task_missing", "save_as": "cors" }, { "action": "expect_status", "source": "$cors", "equals": 204 }, { "action": "expect_header", "source": "$cors", "name": "access-control-allow-methods", "contains": "PATCH" }] },
    { "case_id": "legacy_I_backend_patch", "title": "I backend PATCH persistence", "feature_id": "todo.patch_persistence", "requirement_refs": ["req_task_patch_persistence"], "scenario": "persistence", "priority": "P0", "effective_tier": "fast", "kind": "api", "risk": "mutating", "confidence": 1, "execution_policy": { "production_allowed": false, "retries": 0 }, "setup": [{ "action": "api_request", "method": "POST", "path": "/api/tasks", "body": { "title": "patch item", "priority": "normal" }, "save_as": "created" }], "steps": [{ "action": "api_request", "method": "PATCH", "path": "/api/tasks/${responses.created.body.id}", "body": { "priority": "high", "completed": true }, "save_as": "updated" }, { "action": "api_request", "method": "GET", "path": "/api/tasks/${responses.created.body.id}", "save_as": "reloaded" }, { "action": "expect_json", "source": "$reloaded", "path": "priority", "equals": "high" }, { "action": "expect_json", "source": "$reloaded", "path": "completed", "equals": true }], "cleanup": [{ "action": "api_request", "method": "DELETE", "path": "/api/tasks/${responses.created.body.id}", "save_as": "deleted" }, { "action": "expect_status", "source": "$deleted", "equals": 204 }] },